timestamp,symbol,clean_text,original_sentiment,nlp_label,nlp_score
2026-06-17 16:07 ET,ALOT,pre-market movers currently higher after earnings - astronova alot up 7.4 - fuelcell fcel up 2.7 - duluth holdings dlth up 2.1 - campbell39s cpb up 2.0 currently also higher - corning glw up 8.5 after amazon amz,None,bullish,0.9396
2026-06-17 16:11 ET,HOOD,a lil birdy told me there setting up an offering right now,None,neutral,0.9094
2026-06-17 16:11 ET,HOOD,sorry you missed the boat you cuck. blocked and reported,None,bearish,0.8926
2026-06-17 16:11 ET,RXT,partnerships. come on man. how many companies have both?,Bullish,neutral,0.9294
2026-06-17 16:11 ET,RXT,just load and dont worry about the price. triple within 6 months. possibly sooner,Bullish,neutral,0.8933
2026-06-17 16:11 ET,RXT,market wants us to believe that this isnt worth 10 already ok bud prob the same ppl who sold micron at 300,None,neutral,0.8582
2026-06-17 16:11 ET,RXT,when 10?,Bullish,neutral,0.8334
2026-06-17 16:11 ET,RXT,now that we have some news about how they will fund this deal we can say before this week it was 80 going to happen to now about 99. i been repeatedly saying we needed news on how they will proceed. more news to come on funding but this is a start. this has a lot more to g,Bullish,neutral,0.799
2026-06-17 16:11 ET,RXT,problem is will it be how it acted for a month and dump to 5.92 to fill the gap or will it go over 7.65,None,neutral,0.6163
2026-06-17 16:11 ET,RXT,yesterdays news about deal was huge. in my opinion is an inflexion point. the agreenent starts with 30mw and much more to come. this deal will translate into a long-term multi-million partnership between rack and amd. stock price will explode at any moment.,Bullish,neutral,0.8509
2026-06-17 16:11 ET,RXT,"the waiting is always the hardest part. you find a company that has been tapped on the shoulder by two large firms to do business with. that says something. i look for opportunities like this. even though and didn39t disclose the value of this deal, it is still",Bullish,neutral,0.8913
2026-06-17 16:11 ET,RXT,buy everything you can at these prices. same with,Bullish,neutral,0.9384
2026-06-17 16:11 ET,RXT,"sleeper, still under the radar.. wont be for long.",Bullish,neutral,0.602
2026-06-18 18:52 ET,ARDX,nice move today on some big volume. obviously because i sold a little this week im still terribly not right sized,None,bearish,0.7697
2026-06-18 18:52 ET,ARDX,how many times have we said is this finally it? is it going up to what most analysts predict or are the evil forces going to drag it down again,None,neutral,0.7773
2026-06-18 18:52 ET,ARDX,checking in. what39s the latest news?,Bullish,neutral,0.9161
2026-06-18 18:52 ET,ARDX,ene,None,neutral,0.0
2026-06-18 18:52 ET,ARDX,killed all of them open 6 puts. lol,None,neutral,0.8039
2026-06-18 18:52 ET,ARDX,is it monday yet?,Bullish,neutral,0.761
2026-06-18 18:52 ET,ARDX,"6? dont go crazy now, ardy",None,neutral,0.8518
2026-06-18 18:52 ET,ARDX,interesting volume on the close,None,neutral,0.8242
2026-06-18 18:52 ET,ARDX,,Bullish,neutral,0.0
2026-06-18 18:52 ET,ARDX,prolonged misery ending ? ?,Bullish,neutral,0.5034
2026-06-18 18:52 ET,BFLY,thats fluffy and pump and dump news imo. watch for a huge correction monday,Bearish,mixed,0.5063
2026-06-18 18:52 ET,BFLY,"in november 2025, butterfly network announced a co-development and licensing agreement with midjourney involving butterflys semiconductor-based ultrasound-on-chip technology. under the agreement, midjourney received an exclusive license to use certain butterfly technologie",Bullish,bullish,0.6582
2026-06-18 18:52 ET,BFLY,health caremedicine may be the biggest benefactor from ai. look for it to become a big theme in the second half. check what ray kurzweil had to say,None,neutral,0.908
2026-06-18 18:52 ET,BFLY,just do your own dd. this is turning into clownville.,Bullish,bearish,0.5828
2026-06-18 18:52 ET,BFLY,just chase everything these days,None,neutral,0.908
2026-06-18 18:52 ET,BFLY,ill hear no crying when shorts get murdered monday after billions of impressions all over social media on this midjourney tech leads to catastrophic amounts of fomo,Bullish,bearish,0.7891
2026-06-18 18:52 ET,BFLY,what are you talking about. isnt making the scanners. they are licensing their technology and selling the chips to midjourney for revenues and royalties. bfly is an fda approved company with their handheld ultrasound probe and the fourth generation chip sched,Bullish,neutral,0.9108
2026-06-18 18:52 ET,BFLY,the market is clearly rewarding strength here.,None,bullish,0.9421
2026-06-18 18:52 ET,BFLY,"so this ran because elon replied cool to a comment about a company that partners with butterfly ? im guessing the memory chip stocks running today also helped . but, if anyone read the ceo of butterfly comments , he has claimed some impossible things. claiming to ha",Bearish,neutral,0.8528
2026-06-18 18:52 ET,BFLY,"thanks, im a long term investor since 2021 with a substantial investment. i know where is headed.",Bullish,neutral,0.7263
2026-06-18 18:52 ET,CAT,coop,Bullish,neutral,0.0
2026-06-18 18:52 ET,CAT,"all these stocks hit new 52 week highs at some point today todays tape delivered a rare macro consensus alignment. this fresh 52-week high list bridges global heavy industry, leading-edge semiconductor tooling, and wall street39s p",None,neutral,0.5453
2026-06-18 18:52 ET,CAT,"wow just wow, raised the dividend too",Bullish,bullish,0.8984
2026-06-18 18:52 ET,CAT,june 18 pl day alerts highlights,None,neutral,0.8363
2026-06-18 18:52 ET,CAT,"multi-sector strength hitting the tape - industrials, semis, banks, and high-beta ai infra all printing new 52-week highs in the same session. thats not isolated momentum thats broad risk-on repricing. - industrial cycle strength tied to infrastructure global cap",None,bullish,0.9154
2026-06-18 18:52 ET,CAT,the greatest stock of all time i am expecting some space machinery to come,Bullish,neutral,0.8294
2026-06-18 18:52 ET,CAT,meow im in the mode!,None,neutral,0.7419
2026-06-18 18:52 ET,CAT,"waiting for the cross , then split around 1000.",Bullish,neutral,0.9346
2026-06-18 18:52 ET,CAT,"cat yeah about 600 points ago, yet the scam market pumps everyday all of these...it hilarious...billions of meme stock now",None,neutral,0.8728
2026-06-18 18:52 ET,CAT,is it just me or iis this overvalued by a lot?,Bearish,neutral,0.8146
2026-06-18 18:52 ET,DIS,sold off at 102.5 break sold off at 103.80 break only runners left,Bullish,neutral,0.9058
2026-06-18 18:52 ET,DIS,,None,neutral,0.0
2026-06-18 18:52 ET,DIS,"just stopped by to see what a loser stock and company looks like. oh, and to make fun of the adult losers who think disney is a great place to vacation.",None,neutral,0.8284
2026-06-18 18:52 ET,DIS,"box office sales in 2026 are running about 15 ahead of last year, and toy story 5 could be one of the summer39s biggest draws. wall street loves to write off theaters, but is flashing a bullish macd cross. riding along too. the big franchises still pull people in.",Bullish,neutral,0.7122
2026-06-18 18:52 ET,DIS,toy story 5,None,neutral,0.9106
2026-06-18 18:52 ET,DIS,"hollywood is looking to toy story 5 as a key driver of what is shaping up to be a strong comeback year for the movie industry. following a string of unexpected box-office successes, domestic ticket sales in 2026 are already running roughly 15 ahead of last year, raising hopes th",None,bullish,0.9458
2026-06-18 18:52 ET,DIS,at least and had a green day! comcast still hitting 13 to 15 year lows.,None,bearish,0.8801
2026-06-18 18:52 ET,DIS,staying at the wilderness lodge. just paid almost 300 dollars for my kid to get dressed up like a princess. parks were all busy. i was like this company must make a killing and im sure the stock price would show that. and yet here i am. what happened here?,None,bearish,0.5999
2026-06-18 18:52 ET,DIS,lower gas certainly good for disney,Bullish,bullish,0.8253
2026-06-18 18:52 ET,DIS,are the results on august 5th? what period do they cover? will wc fifa be included?,None,neutral,0.945
2026-06-18 18:52 ET,HQ,30 to 40.. all the best to holders..,Bullish,neutral,0.8878
2026-06-18 18:52 ET,HQ,,Bullish,neutral,0.0
2026-06-18 18:52 ET,HQ,all the way..no questions asked.. target 30.. 40 is very much possible..,Bullish,neutral,0.9039
2026-06-18 18:52 ET,HQ,lol.,None,neutral,0.0
2026-06-18 18:52 ET,HQ,dont listen to noise.. hold your hq..,Bullish,neutral,0.8853
2026-06-18 18:52 ET,HQ,top gainers pt2,None,neutral,0.0
2026-06-18 18:52 ET,HQ,"quantum software spac, zero revenue, up 48 on hype. the quot2-year pipe lockupquot story appears false 52m insider shares are already cleared to sell per sec filings. be careful.",None,bearish,0.4895
2026-06-18 18:52 ET,HQ,congrt dip buyers.. always take profit,None,neutral,0.9078
2026-06-18 18:52 ET,HQ,they want this at 150 this year,Bullish,neutral,0.8471
2026-06-18 18:52 ET,HQ,hope it spreads to others,Bullish,neutral,0.7807
2026-06-18 18:52 ET,MRNA,"as i have written several times here, needs to offer a real, new investing thesis to its investors. if the stock is held mostly by naive people hoping that novavax would be able to get a free ride betting that the fda would be that insane to self-destroy america39s",None,neutral,0.8141
2026-06-18 18:52 ET,MRNA,wonder what made them change their mind,None,neutral,0.7699
2026-06-18 18:52 ET,MRNA,vote 9-0 interesting,None,neutral,0.8602
2026-06-18 18:52 ET,MRNA,1250 before earnings,Bullish,neutral,0.9089
2026-06-18 18:52 ET,MRNA,"funny how nvax baggies constantly attack . please don39t compare a successful well run company to a failure. moderna took advantage of the covid boom, built a huge war chest, and now has multiple late-stage oncology programs with potentially game-changing upside.",None,neutral,0.8063
2026-06-18 18:52 ET,MRNA,"all these stocks hit new 52 week highs at some point today today39s 52-week high list displays flawless portfolio balancing, as institutional capital aggressively synchronizes defensive value with hyper-growth momentum. financial ti",None,bullish,0.7744
2026-06-18 18:52 ET,MRNA,mrna stock clocks best week in over 4 years on fda advisory committee endorsement for flu vaccine,None,bullish,0.8178
2026-06-18 18:52 ET,MRNA,when i say this is just the start it really is.,None,neutral,0.8915
2026-06-18 18:52 ET,MRNA,are,Bullish,neutral,0.0
2026-06-18 18:52 ET,MRNA,"bitcoin isnt high risk bro if it is, so is and",Bullish,neutral,0.8802
2026-06-18 18:52 ET,QS,if we get an all time high i would genuinely cry,Bullish,neutral,0.4942
2026-06-18 18:52 ET,QS,can we get some sandis movement so i can retire plz thank you,None,neutral,0.839
2026-06-18 18:52 ET,QS,so much more to comejust be readydoing dd is fundamental lol,Bullish,neutral,0.7606
2026-06-18 18:52 ET,QS,another 500 shares added ah. going to be at 10k shares faster than anticipated lolthe rr here is undeniablelong amp strong,Bullish,mixed,0.5026
2026-06-18 18:52 ET,QS,????????????,Bullish,neutral,0.8
2026-06-18 18:52 ET,QS,me thinks fake bids in after hours seems tired at 8.10 area. caution is in order lots of red candles 9 to 9.5 seems risky here just fyi. god bless,Bearish,neutral,0.7189
2026-06-18 18:52 ET,QS,research agreement,None,neutral,0.9304
2026-06-18 18:52 ET,QS,maybe see if you can get a squeeze alert for,None,neutral,0.901
2026-06-18 18:52 ET,QS,"doing my part, 32,000 shares",Bullish,neutral,0.8674
2026-06-18 18:52 ET,QS,lets gooooo honda!!,Bullish,neutral,0.867
2026-06-18 18:52 ET,UUUU,uuuu thanks for the free money! short 16 puts did just fine!,None,bullish,0.8295
2026-06-18 18:52 ET,UUUU,"i know this is the future. theres betting going on when ww3 kicks off. some say end of 2026. either way, the sun is glorious but this is the way. look at all the srm stuff. i have a way safe uranium play that has workes better for me but this..... this is risky. they have s",None,neutral,0.8458
2026-06-18 18:52 ET,UUUU,drizz,Bullish,neutral,0.0
2026-06-18 18:52 ET,UUUU,"if the financing approval is confirmed, it does support sentiment for the uranium and rare earth theme, so short-term flow into names like is possible, but it still needs volume follow-through to sustain. im watching this sector too, follow me and i",None,neutral,0.6546
2026-06-18 18:52 ET,UUUU,just a reminder that june 22nd is the end of the first 60 day sprint by the doe through the defense production act nuclear fuel cycle consortium,None,neutral,0.898
2026-06-18 18:52 ET,UUUU,i wonder if some tech giant will jist come in and buyout the sector their competition will be dependent on? in my eyes these tech companies all face the same issue. that issue is everything upgrades and becomes obsolete. so why not convert a fraction yourself and gain,None,neutral,0.9119
2026-06-18 18:52 ET,UUUU,the point of no return with rare earths out of china was crossed. its on us now,Bullish,neutral,0.8797
2026-06-18 18:52 ET,UUUU,the truth,Bullish,neutral,0.854
2026-06-18 18:52 ET,UUUU,save powder for the next month.,Bullish,neutral,0.9291
2026-06-18 18:52 ET,UUUU,"next up 15-15.80 the quick money has passed now they39ve got the algos and ai watching and waiting to shake, frustrate, or buy on a dipoffering.",Bullish,neutral,0.8685
2026-06-18 18:52 ET,AAT,"share price 23.36 contract selected jan 15, 2027 22.5 calls buy zone 1.61 1.99 target zone 2.98 3.65 potential upside 75 roi time to expiration 226 days updates via",None,neutral,0.9143
2026-06-18 18:52 ET,AAT,"top insider buys ahs director loaded 244,300 shares at 4.831.18m buy. biggest size on the board. director bought 33,283 shares at 18.64620k insider scoop. 10 owner frank stansberry added 20,100 shares at 17.21346k conviction buy.",None,neutral,0.9177
2026-06-18 18:52 ET,AAT,"q1 3926 earnings results amp recap reported gaap eps of 0.08 down -88.57 yoy reported revenue of 110.59m up 1.83 yoy american assets trust affirms its full year 2026 ffo per diluted share guidance range of 1.96 to 2.10 per share, with a midpoint of 2.03.",None,bullish,0.828
2026-06-18 18:52 ET,AAT,"- american assets trust inc. common stock - 10k - updated risk factors aats 2026 10-k sharpens focus on office softness, tenant and retail co-tenancy risks, capital and mortgage refinancing constraints, hotter competition for deals, concentrated top tenants, cyberai and",None,neutral,0.6472
2026-06-18 18:52 ET,AAT,is a multifamily reit with a focus on sunbelt markets it faces near-term headwinds from new supply and moderating rent growth but benefits from long-term demographic trends.,None,bullish,0.5739
2026-06-18 18:52 ET,AAT,"q4 3925 earnings results amp recap reported gaap eps of 0.05 down -66.67 yoy reported revenue of 110.09m down -2.97 yoy american assets trust introduced 2026 annual guidance for ffo per diluted share ranging from 1.96 to 2.10, with a midpoint of 2.03, refl",None,bearish,0.8855
2026-06-18 18:52 ET,AAT,,Bullish,neutral,0.0
2026-06-18 18:52 ET,AAT,deep value play here with it being off its highs by 35 - good cash flow - steady quarterly dividend - nice yield!!! got it! recent upgrade to buy by zachs,Bullish,bullish,0.881
2026-06-18 18:52 ET,AAT,"- american assets trust inc. common stock - 10q - updated risk factors aat flags expanded risks from trade policies impacting tenants, leasing, development costs, and financials, and adds new concerns over tenant exposure to prolonged federal government shutdowns. reales",None,neutral,0.7506
2026-06-18 18:52 ET,AAT,american assets trust is a retail and office reit with high-quality properties but faces secular headwinds in some segments,None,bearish,0.9466
2026-06-18 18:52 ET,ABG,"share price 199.81 contract selected jan 15, 2027 200 calls buy zone 19.89 24.57 target zone 34.95 42.72 potential upside 66 roi time to expiration 212 days updates via",None,neutral,0.9271
2026-06-18 18:52 ET,ABG,"its not that theres been growth in sales, inflation has driven these balances higher. this all rolls over in 2027. delinquencies will increase, especially in subprime.",None,bearish,0.7454
2026-06-18 18:52 ET,ABG,"reported -21.26 yoy eps growth for q1, down from -8.13 in q4.",None,bearish,0.9758
2026-06-18 18:52 ET,ABG,q1 3926 earnings results amp recap reported gaap eps of 9.90 up 47.10 yoy reported revenue of 4.11b down -0.86 yoy,None,bearish,0.9264
2026-06-18 18:52 ET,ABG,reported - eps and - revenue for q1.,None,neutral,0.9373
2026-06-18 18:52 ET,ABG,"offers the cleanest, most data-backed insider signal out there. the combo of multiple buyers, a tight market cap, and solid volume makes it the best insider play on the us market, imo.",Bullish,bullish,0.8456
2026-06-18 18:52 ET,ABG,the beauty of abg is that youve got the ceo going all-in on a dirt-cheap valuation. this isn39t some hype-train play its a smart move on a massive profit machine that the market is totally sleeping on right now.,Bullish,neutral,0.8668
2026-06-18 18:52 ET,ABG,"ceo purchased 5,000 shares at 205.34 for a total of 1,026,706. hult david w now owns 90,683 shares.",Bullish,neutral,0.9529
2026-06-18 18:52 ET,ABG,"ceo purchased 5,000 shares at 205.34 for a total of 1,026,706. hult david w now owns 90,683 shares.",Bullish,neutral,0.0
2026-06-18 18:52 ET,ABG,"share price 217.10 contract selected jul 17, 2026 220 calls buy zone 31.96 39.48 target zone 56.22 68.72 potential upside 66 roi time to expiration 141 days updates via",None,neutral,0.9218
2026-06-18 18:52 ET,ABNB,"attacking 144 again, come on bulls make it stick this time",None,neutral,0.8183
2026-06-18 18:52 ET,ABNB,"i am super bullish on , one of my bigger holders long term. i think they are priced very fairly hard to find nowadays and i think they have much more growth potential than its currently pricing in... also vs industry peers deliveringride sharing they are on the cheap si",None,neutral,0.6402
2026-06-18 18:52 ET,ABNB,i languished in this for a while a while ago. then i discovered my dignity and self respect.,None,neutral,0.8442
2026-06-18 18:52 ET,ABNB,nuff said,None,neutral,0.8727
2026-06-18 18:52 ET,ABNB,"i have told you about the quotmulti-stagequot pilot synchronization that is fully completed in cc9.8, so it is critical to weigh both when reviewing a stock for investment purposes, and i did just that at 120 last year. reason i chilled and filled my buy orders.",None,neutral,0.9034
2026-06-18 18:52 ET,ABNB,"rewind back to 2025 for this discussion. below, the cc calendar now includes world event boxes gray, the ones that affect our markets in us, and also new for cc9.8, lavender boxes that are pooling major buyer activity. you can see how the tariff event was surrounded b",None,neutral,0.9457
2026-06-18 18:52 ET,ABNB,"hey, maybe silly lines do work, you just have to get lucky when you draw them. i do not use luck, i39ll show you the cc calendar, a fairly new component that lets you engage a trade in real-time wit actual proof and confidence, not guessing!",None,neutral,0.9171
2026-06-18 18:52 ET,ABNB,this one starting to run.,None,neutral,0.8579
2026-06-18 18:52 ET,ABNB,do you feel weird knowing cameras are watching you and could be anywhere in the house? 55,None,neutral,0.7589
2026-06-18 18:52 ET,ABNB,"too early to make the call but it finally managed to get above a resistance level at 140.36 but there is some more work to do. hopefully, it is now heading to test the 144-146 range for maybe a potential breakout to the upside. imho, the world cup should help this quart",Bullish,bullish,0.7555
2026-06-18 18:52 ET,ABTC,,None,neutral,0.0
2026-06-18 18:52 ET,ABTC,board members buys 450k shares at .87,Bullish,neutral,0.9291
2026-06-18 18:52 ET,ABTC,those 2.50 leaps at .35 and 1 leaps at .50 are a blessing to able to accumulate.,Bullish,neutral,0.7137
2026-06-18 18:52 ET,ABTC,stats say this company has two employees.... what do these employees do?,None,neutral,0.7462
2026-06-18 18:52 ET,ABTC,.x,None,neutral,0.0
2026-06-18 18:52 ET,ABTC,the next . they own the same amount of .x as 900 million market cap 1.2 million market cap lol,Bullish,neutral,0.9553
2026-06-18 18:52 ET,ABTC,wide pattern of crypto voices flagging capital rotation away from bitcoin into ai.,Bearish,bearish,0.7055
2026-06-18 18:52 ET,ABTC,,Bullish,neutral,0.0
2026-06-18 18:52 ET,ABTC,"first week of july they will receive their noncompliance letter for all those asking. if management doesnt already go through with the 40 to 1 reverse split themselves, they will have 6 months",Bearish,neutral,0.859
2026-06-18 18:52 ET,ABTC,.x,Bullish,neutral,0.0
2026-06-18 18:52 ET,ABUS,"ended with gt 5m volume today, largest since april. that was at the bottom of the channel. this was at the top. are we getting close to launch?",None,neutral,0.7954
2026-06-18 18:52 ET,ABUS,looks like someone dumped between 2 and 3 million shares in the last 10 minutes.,None,bearish,0.8512
2026-06-18 18:52 ET,ABUS,ah action,Bullish,neutral,0.8551
2026-06-18 18:52 ET,ABUS,"4 millions and its not rebalancing, what is going on here ?",None,neutral,0.5928
2026-06-18 18:52 ET,ABUS,the price didn39t move much but the volume is about quadruple the 10-day average volume. that39s really intriguing....,None,neutral,0.8234
2026-06-18 18:52 ET,ABUS,now almost 5 million traded,None,neutral,0.9047
2026-06-18 18:52 ET,ABUS,4 million volume?,None,neutral,0.8215
2026-06-18 18:52 ET,ABUS,1.6m block at the close. things are happening,None,neutral,0.8615
2026-06-18 18:52 ET,ABUS,have we lost nile?,None,bearish,0.8196
2026-06-18 18:52 ET,ABUS,my personal liberation day will be the day i can finally say goodbye to arbutus and you fine folks.,Bullish,neutral,0.8571
2026-06-18 18:52 ET,ACA,this looking petty good into next week,None,bullish,0.5597
2026-06-18 18:52 ET,ACA,"changes to medicaid, the and other key provisions of the one big beautiful bill act updated apr 24, 2026 5 min read the one big beautiful bill act of 2025 obbba, the massive budget reconciliation bill implementing many of the administrations top legislative p",None,neutral,0.8934
2026-06-18 18:52 ET,ACA,"fundamental analysis of arcosa, inc. based on financial data and reported results. aca",None,neutral,0.9446
2026-06-18 18:52 ET,ACA,wall st is expecting 1.22 eps for q2 reporting 0805 amc,None,neutral,0.901
2026-06-18 18:52 ET,ACA,new research today on sidotiresearch read note investing smallcap microcap,None,neutral,0.9349
2026-06-18 18:52 ET,ACA,"q1 3926 earnings results amp recap reported gaap eps of 0.77 up 60.42 yoy reported revenue of 571.7m down -9.54 yoy arcosa raised its full-year 2026 guidance for continuing operations, with revenues now expected between 2.6 billion and 2.7 billion, and adju",None,bullish,0.9498
2026-06-18 18:52 ET,ACA,lfg adding,Bullish,neutral,0.9268
2026-06-18 18:52 ET,ACA,new research today on sidotiresearch read note investing smallcap microcap,None,neutral,0.0
2026-06-18 18:52 ET,ACA,"share price 107.49 contract selected nov 20, 2026 145 calls buy zone 0.09 0.11 target zone 0.14 0.17 potential upside 57 roi time to expiration 231 days updates via",None,neutral,0.9153
2026-06-18 18:52 ET,ACA,new research this week on sidotiresearch read note investing smallcap microcap,None,neutral,0.9259
2026-06-18 18:52 ET,ACH,"transacted an early settlement of its exchange offers, issuing 539.25 million of new senior secured notes and amending its indentures.",None,bullish,0.8346
2026-06-18 18:52 ET,ACH,wall st is expecting -0.08 eps for q2 reporting 0731 bmo,None,neutral,0.7366
2026-06-18 18:52 ET,ACH,we fly tomorrow,Bullish,neutral,0.9263
2026-06-18 18:52 ET,ACH,,Bullish,neutral,0.0
2026-06-18 18:52 ET,ACH,,None,neutral,0.0
2026-06-18 18:52 ET,ACH,reported -0.04 eps and 627.80 revenue for q1.,None,neutral,0.873
2026-06-18 18:52 ET,ACH,"q1 3926 earnings results amp recap accendra health is affirming its prior guidance for net revenue and adjusted ebitda for the full year 2026, indicating maintained financial expectations for the upcoming period.",None,bullish,0.9134
2026-06-18 18:52 ET,ACH,.0096 next!!!,Bullish,neutral,0.8607
2026-06-18 18:52 ET,ACH,"if there was an alt season which their wasnt as scheduled this would have landed in the .07 to .10 range for sure. when alt season comes and it will this is is going to explode to the .09 to .12 range... hold for the gold people. patience is an expensive gift, dont expe",Bullish,neutral,0.8734
2026-06-18 18:52 ET,ACH,ondo up 35 today amd 75 in 1 month.. ach.x and ondo.x are partners,Bullish,bullish,0.6957
2026-06-18 18:52 ET,ACMR,"im still trying to map out where the clean nav discount real ai growth setups are showing up. names like , wus 2316, and even sk square type structures are the kind i keep coming back to. what stands out to me is the mismatch between how the market values them st",None,neutral,0.8634
2026-06-18 18:52 ET,ACMR,labels,Bullish,neutral,0.832
2026-06-18 18:52 ET,ACMR,"acm shanghai is worth roughly 25-26b today. acmr owns 73.6 of it, implying a stake value of 18b. yet acmrs entire market cap is only 6-7b.thats the valuation gap investors believe the hong kong listing could help unlock.",Bullish,neutral,0.7207
2026-06-18 18:52 ET,ACMR,heaviest volume of the day came at the close and ath.,None,neutral,0.7878
2026-06-18 18:52 ET,ACMR,finally making some real money! this is my second largest holding behind,Bullish,neutral,0.8424
2026-06-18 18:52 ET,ACMR,calling me names doesn39t make you better.,Bullish,neutral,0.5859
2026-06-18 18:52 ET,ACMR,a monster gltal,Bullish,neutral,0.8196
2026-06-18 18:52 ET,ACMR,"regrets with , that had a nasty 70 to 37 plunge where i was shaken out along the way",None,bearish,0.4677
2026-06-18 18:52 ET,ACMR,beastie,None,neutral,0.8202
2026-06-18 18:52 ET,ACMR,wow how far this has come,None,neutral,0.6722
2026-06-18 18:52 ET,ACON,.x brain,Bullish,neutral,0.9308
2026-06-18 18:52 ET,ACON,to the top,Bullish,neutral,0.846
2026-06-18 18:52 ET,ACON,icon,Bullish,neutral,0.0
