timestamp,symbol,clean_text,original_sentiment,nlp_label,nlp_score
2026-06-20 14:05 ET,HQ,target 40 dont forget ran from 7 to 44 in 5 days.. hq is low float. owns 13 and dell owns 8. described as microsoft of the quantum world..,Bullish,neutral,0.9238
2026-06-20 14:05 ET,HQ,wow! i dont think we pull a xanadu because no lockup issue but this could continue beyond belief in my opinion. been waiting for this !,Bullish,neutral,0.8208
2026-06-20 14:05 ET,MRNA,even russian bears couldn39t believe their eyes that moderna managed to survive and thrive under rfk jr. now imagine how much things are going to be so much better once that troublemaker is removed.,Bullish,neutral,0.5613
2026-06-20 14:05 ET,MRNA,why are they still around?,None,bearish,0.563
2026-06-20 14:05 ET,MRNA,bullish take axsomes fda approval is a huge win for igc. it validates that alzheimers agitation is a multi-billion-dollar market and proves the fda is open to non-antipsychotic treatments. massive market opportunity now confirmed by wall stree,Bullish,bullish,0.8933
2026-06-20 14:05 ET,MRNA,ascendiants 5.50 price target on a 0.28 stock reflects what could happen if igc delivers on its pipeline. huge alzheimers agitation market with limited approved treatments. clinical validation from the prestigious icahn school of medicine at mount sinai joi,Bullish,neutral,0.8885
2026-06-20 14:05 ET,MRNA,contraian,None,neutral,0.8768
2026-06-20 14:05 ET,MRNA,"new coo came from zoetis, animal vaccines next?",None,neutral,0.9133
2026-06-20 14:05 ET,MRNA,we39ll let this one slide you moderna holders next time i am calling captain chowda and it39s over for you all.,Bullish,neutral,0.9051
2026-06-20 14:05 ET,MRNA,this thing exploded. whales knew those calls 100 from 64 and still time on them,None,neutral,0.9141
2026-06-20 14:05 ET,MRNA,"aww what wrong, you don39t like vax? come on, you39re a big boy now. you can39t handle a little tiny needle with the see through liquid? no no no, it was just a coincidence everyone got a heart attack and lost their scent of smell. no conspiracies in here, you3",Bearish,neutral,0.6092
2026-06-20 14:05 ET,MRNA,"100. many older nvax investors naively believe it39s still protein vs mrna. to see how this is false, just visit . while moderna is mentioned in every posts here, almost all investors in mrna couldn39t care less to even mention novavax because the 2 are not even",None,neutral,0.8772
2026-06-20 14:05 ET,QS,"still climbing and there are no signs of exhaustion yet. the buyers keep stepping in on every push higher. when a move keeps this much energy, the smart money usually doesn39t want you watching too closely",Bullish,neutral,0.8412
2026-06-20 14:05 ET,QS,quantumscape corporation spicytrade - daily stock analysis,None,neutral,0.9475
2026-06-20 14:05 ET,QS,the holy grail ! 50,Bullish,neutral,0.8866
2026-06-20 14:05 ET,QS,"still climbing and there are no signs of exhaustion yet. the buyers keep stepping in on every push higher. when a move keeps this much energy, the smart money usually doesn39t want you watching too closely",Bullish,neutral,0.0
2026-06-20 14:05 ET,QS,you forgot to plug your korean telecommunication stock skm.,None,neutral,0.8521
2026-06-20 14:05 ET,QS,"okay shorts, fair warning. qs has tight security so you had no warning until just before markets opened. it will be that way every time, rewarding the faithful longs. ultimatum close your positions or face extinction.",None,neutral,0.8408
2026-06-20 14:05 ET,QS,wants back in cheaper,Bullish,neutral,0.8752
2026-06-20 14:05 ET,QS,"rampd agreement secured with honda is an absolute joke. time for leadership to talk about a mass manufacturing agreement at gig scale. as retail pumps this, they are idiots to realize vw just signed an agreement with factorial . this is a pump and dump scheme.",None,neutral,0.8506
2026-06-20 14:05 ET,QS,im a long term bull at qs. rampd agreement with honda is an absolute joke. time to hold learship responsible. we need answers on the upcoming earnings call. rampd agreement will sell off so hard it wont even be funny. i expect the insiders to immediately quit selli,None,bearish,0.86
2026-06-20 14:05 ET,QS,the momentum is strong here.,Bullish,bullish,0.89
2026-06-20 14:05 ET,UUUU,,Bullish,neutral,0.0
2026-06-20 14:05 ET,UUUU,"automakers are facing one of the biggest supplychain challenges in their history. every electric vehicle requires rare earth magnets and right now, over 90 of those materials come from china. thats a massive risk for companies like ford, gm, tesla, toyota, and every ev",Bullish,bearish,0.6304
2026-06-20 14:05 ET,UUUU,"longterm investors need to understand how important the next few months are for energy fuels. the 725m government loan is only the beginning. once the white mesa mill retooling is completed and the asm partnership is officially finalized, the company will finally be in po",Bullish,neutral,0.7729
2026-06-20 14:05 ET,UUUU,"many investors still dont realize how important the structure of the 725m government loan truly is. this isnt dilution, it isnt a share offering, and it isnt a highinterest burden. its a 20year, lowinterest loan that allows energy fuels to build out the white mesa",Bullish,neutral,0.8918
2026-06-20 14:05 ET,UUUU,"the recent discussion about energy fuels 725m conditional loan commitment needs to be understood clearly. this isnt just financing its a 20year, lowinterest government loan that requires no dilution to shareholders. that alone is a major win for longterm investors.",Bullish,bullish,0.8159
2026-06-20 14:05 ET,UUUU,"thelasthope, i appreciate your post and the points you raised. sodiumion batteries are an exciting development, and the cost improvements are real. but even with those advances, largescale utilities and grid operators are still warning that aidriven power demand is risin",Bullish,mixed,0.3902
2026-06-20 14:05 ET,UUUU,"what you are talking has been disproven. with sodium ion battery breakthrough, solar and wind can provide247 baseload power. the cost of batteries reduced by 70 in 24 months and the energy density has increased quite a bit.",None,bullish,0.7654
2026-06-20 14:05 ET,UUUU,this is the sort of action that sneaks onto your top list,None,neutral,0.9044
2026-06-20 14:05 ET,UUUU,- great article below!,None,neutral,0.9214
2026-06-20 14:05 ET,UUUU,.un sprott uranium monthly. nice cup and handle forming. . good set up for the sector,None,neutral,0.4987
2026-06-20 14:05 ET,ABNB,"plenty of folks don39t like this name, but could be looking at a stage one breakout.",None,neutral,0.9065
2026-06-20 14:05 ET,ABUS,qnc had the same crazy volume .over 54 million shares.,None,neutral,0.9471
2026-06-20 14:17 ET,ARDX,price prediction after q2 earnings?,Bullish,neutral,0.8928
2026-06-20 14:17 ET,ARDX,repost on x w commentary,Bullish,neutral,0.9413
2026-06-20 14:17 ET,ARDX,,None,neutral,0.0
2026-06-20 14:17 ET,ARDX,"apogee does have superior dosing regime. rademikibart regular every 24 weeks zumilokibart only 4 injections for 16-week induction, maintenance every 36 months take a look. this sector is huge and have produced two big bos within a year. apogee is not even in p",Bullish,neutral,0.8414
2026-06-20 14:17 ET,ARDX,youre still here too??,None,neutral,0.8876
2026-06-20 14:17 ET,ARDX,this is a bot... thought you should know. ive seen it here for years. same gifs and all,None,neutral,0.9314
2026-06-20 14:17 ET,ARDX,lmao damn still at 6 bucks... its been 3 years now. give up lol,None,neutral,0.8653
2026-06-20 14:17 ET,ARDX,brief clinical outcome comparison between connect china phase 3 data and apogee efficacy week 16 1. easi-75 rademikibart higher 74.2 vs zumilokibart 65.9 2. iga 01 clearance nearly equal rademikibart 47.7 zumilokibart 46.0 3. easi-90 deep clearance zum,Bullish,bullish,0.7635
2026-06-20 14:17 ET,ARDX,"its partner in china, simcere listed, had highly successful phase 3 trials for eczema and is undergoing nda in china approval expected end of this year or early 2027. the phase 3 produced superior efficacy and safety to both existing treatments like dupixent 18 bill",Bullish,bullish,0.952
2026-06-20 14:17 ET,ARDX,"hi guys, i think some of you might still remember me from the past 4 years. i existed ardx last year because of disappointment in xs situation. i have since diversified into a few other names ardx was like 80 of my portfolio. i just came across one name i want to shar",Bullish,neutral,0.9075
2026-06-20 14:17 ET,BFLY,many ppl have been stuck holding the bag for many years and will offload on monday. then we39ll have new bag holders who are giving crazy price predictions thinking this will reach the sky... this is still a prototype which will take many years to come to reality by,Bearish,neutral,0.7427
2026-06-20 14:17 ET,BFLY,"takes you into new dimension shortie, ok!",None,neutral,0.8973
2026-06-20 14:17 ET,BFLY,27 mio shares short! nice! its payday shorty!,Bullish,neutral,0.6402
2026-06-20 14:17 ET,BFLY,can we see 15 tomorrow??,None,neutral,0.9154
2026-06-20 14:17 ET,BFLY,,None,neutral,0.0
2026-06-20 14:17 ET,BFLY,jesus that happened faster than i thought.,Bullish,neutral,0.7413
2026-06-20 14:17 ET,BFLY,,None,neutral,0.0
2026-06-20 14:17 ET,BFLY,not true! know what own.,None,neutral,0.9188
2026-06-20 14:17 ET,BFLY,,Bearish,neutral,0.0
2026-06-20 14:17 ET,BFLY,2 spacs trending,None,neutral,0.8759
2026-06-20 14:17 ET,HQ,oh aye!,Bullish,neutral,0.7312
2026-06-20 14:17 ET,HQ,"momentum continues to rotate through small caps. are standing out with strong relative volume, notable percentage gains, and repeated appearances across multiple scanners. the names showing up everywhere are often the ones attracting the most attenti",None,mixed,0.4968
2026-06-20 14:17 ET,HQ,wow,None,neutral,0.0
2026-06-20 14:17 ET,HQ,thinking these are good buys for a wealthy future not fa...but dyor. i ain39t alone.,None,neutral,0.7089
2026-06-20 14:17 ET,HQ,"so proud, lil zappy is all grown up. lets seem them legs!",Bullish,neutral,0.8656
2026-06-20 14:17 ET,HQ,,Bullish,neutral,0.0
2026-06-20 14:17 ET,HQ,. nailed the idea but horrible execution. sad,None,bearish,0.676
2026-06-20 14:17 ET,HQ,let39s have a quantum party today!,Bullish,neutral,0.8902
2026-06-20 14:17 ET,HQ,can we touch 40 today?,Bullish,neutral,0.8893
2026-06-20 14:17 ET,HQ,news?,None,neutral,0.0
2026-06-20 14:17 ET,MRNA,"i am not against mrna technology as a whole however, i am firmly against its mass application to the general public as a vaccine. while mrna drugs hold legitimate potential for treating rare, otherwise incurable diseases, the technology itself is still far too unrefined. i",Bearish,neutral,0.82
2026-06-20 14:17 ET,MRNA,"as a biological wet-lab veteran, there have two key structural flaws of mrna tech degraded mrna fragments smear products translate into aberrant truncated proteins, risking off-target autoimmune reactions, while the lack of biological feedback loops allows unregulated, s",Bearish,neutral,0.6554
2026-06-20 14:17 ET,MRNA,we have a mrna fan right here because he is not contend with just getting one shot.,Bullish,neutral,0.872
2026-06-20 14:17 ET,MRNA,i will never have one single mrna shot into my body!,Bearish,neutral,0.5939
2026-06-20 14:17 ET,MRNA,moderna has some key approvals ahead. is the stock a buy?,None,neutral,0.8658
2026-06-20 14:17 ET,MRNA,the man literally just okayed vaping.,None,neutral,0.7071
2026-06-20 14:17 ET,MRNA,,None,neutral,0.0
2026-06-20 14:17 ET,MRNA,us healthcare is a joke. they clearly have dirt on rfk. you all need to get rid of him and get someone in there that won39t be pushed around by big pharma. at least the american people ware waking up and doing their own research. how high do you think you ca,None,neutral,0.8579
2026-06-20 14:17 ET,MRNA,it39s time to hit triple digits,Bullish,neutral,0.7161
2026-06-20 14:17 ET,MRNA,"9-0 vote for over 65 , 9-0 vote 50-64 years for 1010. oncology not priced in",None,neutral,0.9432
2026-06-20 14:17 ET,QS,holding and adding,Bullish,neutral,0.9452
2026-06-20 14:17 ET,QS,wow whats next?,None,neutral,0.9191
2026-06-20 14:17 ET,QS,"remember when the quantum sector pumps this sympathy pumps, would be funny if they start pumping next week.",None,neutral,0.9281
2026-06-20 14:17 ET,QS,good times?,None,neutral,0.8445
2026-06-20 14:17 ET,QS,2 spacs trending,None,neutral,0.0
2026-06-20 14:17 ET,QS,not giving anything back thats strength,None,neutral,0.873
2026-06-20 14:17 ET,QS,check out this really good video on what is happening here,None,neutral,0.9266
2026-06-20 14:17 ET,QS,"this could swing a few dollars up or down. however, i39m assuming honda research amp development geoup has done their evaluation of the technology and green light to have their name tagged. my money is riding on honda39s expertise has done its job.",Bullish,bullish,0.8121
2026-06-20 14:17 ET,QS,did my qs investment actually hold its gains for a day. ?,Bullish,neutral,0.7135
2026-06-20 14:17 ET,QS,"vw grossly undervalued vw and blue solutions aim to reach a joint development agreement in the coming months, according to the source who asked not to be identified",Bullish,bullish,0.9174
2026-06-20 14:22 ET,BFLY,is this gone take off on monday or crash,None,neutral,0.8976
2026-06-20 14:22 ET,BFLY,now they show us the sentiment line citadel had access to for 7 yrs,None,neutral,0.8162
2026-06-20 14:22 ET,BFLY,will crash on monday,Bearish,neutral,0.7129
2026-06-20 14:22 ET,BFLY,lmao..ppl here actually get racist if someone doesnt like there stock..?,None,bearish,0.7453
2026-06-20 14:22 ET,BFLY,lord i see what you have done for butterfly and i want that for,None,neutral,0.719
2026-06-20 14:22 ET,BFLY,,None,neutral,0.0
2026-06-20 14:22 ET,BFLY,,None,neutral,0.0
2026-06-20 14:22 ET,BFLY,looking good. recently awarded fda approval.,Bullish,bullish,0.882
2026-06-20 14:22 ET,BFLY,re hussain patels post on insider selling. several sales were tied to 10b5-1 plans or tax-related transactions. youre selling without really knowing ahead of time if the stock is going to be trading higher or lower. this is used extensively for tax and estate plann,None,neutral,0.805
2026-06-20 14:22 ET,BFLY,open the market!!! open sesame. open. open. open.,None,neutral,0.9224
2026-06-20 14:22 ET,HQ,"sooo.... who do y39all think we shall end up working with...? seems like mr. kapur wouldn39t sit around a fire flapping his jaws for nothing... oh and the other founders getting around too. remember, we have international ip and pat",Bullish,neutral,0.8956
2026-06-20 14:22 ET,HQ,,Bullish,neutral,0.0
2026-06-20 14:22 ET,HQ,all the way up!,Bullish,neutral,0.8057
2026-06-20 14:22 ET,HQ,i heard rumors its getting investigated for unusual price action. ill be selling here for a small gain,None,mixed,0.5162
2026-06-20 14:22 ET,HQ,"big move, but still a small market cap. plenty of room to run. a pure play on quantum software - agnostic of whomever wins the hardware race. cutting edge testbeds in superconducting ions multiple variants and now one of 39s latest systems in dublin for trapped ions",Bullish,neutral,0.7937
2026-06-20 14:22 ET,HQ,"trends with no friends. just 1 shy of 1,000 watchers.",Bullish,neutral,0.9131
2026-06-20 14:22 ET,HQ,up 100 in 3 days!,Bullish,bullish,0.577
2026-06-20 14:22 ET,HQ,"i almost ignored this, which would have been a mistake.",None,bearish,0.5987
2026-06-20 14:22 ET,HQ,"congrats to those that bought this for the short squeeze trade. now is the time to trade this out and into , a huge long-term winner in quantum. will wind up like once insiders dump following their lockup period.",Bullish,neutral,0.8642
2026-06-20 14:22 ET,HQ,you should have said back on june 11th. get your head out of your adderhole,None,neutral,0.574
2026-06-20 14:22 ET,QS,this trash still exists? thought it would39ve went the of romeo,Bearish,neutral,0.8151
2026-06-20 14:22 ET,QS,excited to partner with to advance qs solid-state battery technology and manufacturing. their rigorous evaluation and engineering excellence validate the potential of qs technology across automotive and other applications.,Bullish,bullish,0.8655
2026-06-20 14:22 ET,QS,"top stock gainers thursday, june 18, 2026 intel hits a new all-time high, micron surges 8, and chips carry the market into the long weekend 1. 9.67 to 132.81 new all-time high 133.82 2. 15.87 to 8.00 3. 8 4.",None,neutral,0.0
2026-06-20 14:22 ET,QS,fisher price is next to rampd with quantumscape,None,neutral,0.6697
2026-06-20 14:22 ET,QS,panasonic,None,neutral,0.9421
2026-06-20 14:22 ET,QS,"ogawa achieving high energy density while also making the technology affordable, safe, and easy to recycle and building the ecosystem to support it. but none of this can happen without scaling up. and let me say this clearly the research phase is already over. siva",Bullish,neutral,0.8536
2026-06-20 14:22 ET,QS,name another customer partner and we are off to the moon data center or automotive would be nice,None,neutral,0.9309
2026-06-20 14:22 ET,QS,"and this event is just around the corner. world ducati week 2026 taking place july 35 at misano, with the big centenary show happening exactly on the july 4th anniversary date. from high-performance qse-5 battery testing on the racetrack to a century of legacy, the timing",Bullish,neutral,0.919
2026-06-20 14:22 ET,QS,,Bullish,neutral,0.0
2026-06-20 14:22 ET,QS,,Bullish,neutral,0.0
2026-06-20 14:27 ET,ARDX,is it monday yet?,Bullish,neutral,0.0
2026-06-20 14:27 ET,BFLY,no device like this has ever been built. midjourney39s whole-body scanner prototype captures hundreds of body slices in just 60 seconds a completely new infrastructure for full-body imaging. here39s the technology that makes it possible,Bullish,neutral,0.9164
2026-06-20 14:27 ET,BFLY,,None,neutral,0.0
2026-06-20 14:27 ET,BFLY,"nope, i hang out on social media way too much the thing that most on x and the world dont understand is that midjourney is a butterfly customer. many seem to think butterfly has to develop the technology, test it etc however those who are invested understand",Bullish,neutral,0.9268
2026-06-20 14:27 ET,BFLY,damike you are a shame to your mother you have shown what kind of upbringing you have had....maybe you got bullied at school and now have become a keyboard warrior. we are all here to make money and we should show some manners and respect which unfortunately you lack.,Bearish,neutral,0.8079
2026-06-20 14:27 ET,BFLY,"once it has met the 10-consecutive-day rule above 1, the only way is up. keep an eye on blin. money is flowing in first stop resistance at 1.50, next at 2. in my opinion, we should see 5 before the end of this year. it wouldn39t be surprising if it gets acquired",None,neutral,0.8283
2026-06-20 14:27 ET,BFLY,"yes, indeed. technology is a game changer. ive been a long term investor since they went public in 2021. the next four yes will be very exciting.",Bullish,neutral,0.7373
2026-06-20 14:27 ET,BFLY,"this has some heavy hitters invested , blackrock",None,neutral,0.6296
2026-06-20 14:27 ET,BFLY,if you want to understand how broken the healthcare system is spend some time on x reading posts by doctors who are dismissive and negative of midjourneys ultrasound scanner powered by ultrasound on chip technology. clueless people get left behind in life. healthca,Bullish,neutral,0.5983
2026-06-20 14:27 ET,BFLY,top gainers,None,neutral,0.8741
2026-06-20 14:27 ET,BFLY,"damike that is a stupid stupid post re muslims. you are a racist imbecile, an idiot and an embarrassment to yourself. ive never met you, but i can categorically say that i wouldnt like you if i did. stop posting stupidity and never ever drink alcohol before posting.",None,mixed,0.5157
2026-06-20 14:27 ET,HQ,"lol. the risk that many investors overlook is literally that the leading hardware companies may never need a third-party software layer. firms like ibm, google, and xanadu are already developing their own software ecosystems alongside their hardware. if the industry",Bearish,neutral,0.928
2026-06-20 14:27 ET,HQ,"why the hell did this ran up over 200 in a week compared to . no fucking way this is worth more than infleqtion lol. this will likely crash soon, if not in the next few weeks like did from 40 to the low 10s. it literally had no important news and this is not even",Bearish,neutral,0.5651
2026-06-20 14:27 ET,HQ,people will be paying over 100 for this in few weeks,Bullish,neutral,0.8445
2026-06-20 14:27 ET,HQ,"lock up period supposedly 24 months starting from ipo date, therefore over a-year-and-half to go",Bullish,neutral,0.9327
2026-06-20 14:27 ET,HQ,you39d think with 10x the patents in the qc software space would ketchup already.. but i guess after all it39s only been up listed for a couple days...,Bullish,neutral,0.8923
2026-06-20 14:27 ET,HQ,"20.8 we called the entry at 20.7. our alert hit target 3 36 at 24.5 18.4 in 79m. entries targets, called live every day follow for more",Bullish,neutral,0.9336
2026-06-20 14:27 ET,HQ,proof? where did you hear these quotrumors?quot,Bullish,neutral,0.9063
2026-06-20 14:27 ET,HQ,the market seems eager to support this name.,None,bullish,0.7984
2026-06-20 14:27 ET,HQ,huge buys ah wow,None,neutral,0.7623
2026-06-20 14:27 ET,HQ,"ok, i sold 500 of my 2100 warrents purchased while a spac at around 3.x a shr. for a 450 gain. i39ll let the rest ride quot like a cowboy, into the dawn of montanaquot!",Bullish,neutral,0.8647
2026-06-20 14:27 ET,QS,lets !!!,None,neutral,0.8843
2026-06-20 14:27 ET,QS,,Bullish,neutral,0.0
2026-06-20 14:27 ET,QS,honda not good enough to go 20,None,bearish,0.6993
2026-06-20 14:27 ET,QS,,None,neutral,0.0
2026-06-20 14:27 ET,QS,we need and they need us to beat tsla.,None,neutral,0.6614
2026-06-20 14:27 ET,QS,more jv news aplenty stay tune!!,None,neutral,0.9076
2026-06-20 14:27 ET,QS,"honda has went public and eagle doesn39t scale, come oneddai !",Bullish,neutral,0.8893
2026-06-20 14:27 ET,QS,nissan has been in the chat,Bullish,neutral,0.7578
2026-06-20 14:27 ET,QS,lets go 300 !!! possible by 2030,Bullish,neutral,0.8893
2026-06-20 14:27 ET,QS,honda is for real!!,Bullish,neutral,0.9126
2026-06-20 14:27 ET,ABUS,"imo, any kind of good new, i.e. partnership, should take us to at least 6.50 on short covering alone.",None,bullish,0.6073
2026-06-20 14:52 ET,BFLY,,Bullish,neutral,0.0
2026-06-20 14:52 ET,BFLY,,None,neutral,0.0
2026-06-20 14:52 ET,BFLY,"next few weeks will be epic! some will be speechless, others in disbelief, and many naysayers will tell you why ultrasound on chip technology isnt a game changer. bfly is no longer a medical device company. its a semiconductor company with extraordinary chip and a",Bullish,neutral,0.9153
2026-06-20 14:52 ET,BFLY,,None,neutral,0.0
2026-06-20 14:52 ET,BFLY,sa author was wasn39t sure about med-tech multiple versus high-margin saas mumtiple for bly and did not have the vision to see what39s coming. however i loved this reader39s vision and his persistence. i am new here. would love to see mayo man39s vision or stock,Bullish,neutral,0.8956
2026-06-20 14:52 ET,BFLY,your advisor is fired asap,None,bearish,0.8735
2026-06-20 14:52 ET,BFLY,dont be surprised when an offering comes to try and raise money to fund these machines to be built and sold. ive seen this happen all to much. better off holding a short position at these levels imo.,Bearish,neutral,0.779
2026-06-20 14:52 ET,BFLY,any buyout rumors? who would be the natural buyers for bfly?,None,neutral,0.9351
2026-06-20 14:52 ET,BFLY,"9,536 watcher reading up on this.",None,neutral,0.8215
2026-06-20 14:52 ET,BFLY,keep trending,None,neutral,0.9179
2026-06-20 14:52 ET,HQ,every one is taking profits!! target price back to 25 rated a strong sell!!,Bearish,bullish,0.8241
2026-06-20 14:52 ET,HQ,accumulation smells great in the morning.,Bullish,neutral,0.7782
2026-06-20 14:52 ET,HQ,40,Bullish,neutral,0.0
2026-06-20 14:52 ET,HQ,was out of this under 25 i think i made a mistake,None,bearish,0.7646
2026-06-20 14:52 ET,HQ,40 incoming..,Bullish,neutral,0.8544
2026-06-20 14:52 ET,HQ,looks like dillution coming up,Bearish,neutral,0.8055
2026-06-20 14:52 ET,HQ,strategy after this friday - sell puts or buy stocks - do not sell covered calls or go short after this friday until end july. infleqtion has a webinar on 24 june about their advancement in neutral atom anything out of the ordinary including fidelityupdates on ftqc,Bullish,neutral,0.9429
2026-06-20 14:52 ET,HQ,still has the lowest market cap in the quantum world.. average market cap for quantum computing is 5 billion.. owns 13 of hq. dell owns 8.. low float.. went from 7 to 44 in 5 trading days..,Bullish,bearish,0.6916
2026-06-20 14:52 ET,HQ,why is this going up,None,neutral,0.6946
2026-06-20 14:52 ET,HQ,40 incoming.. can we see this today?,Bullish,neutral,0.9241
2026-06-20 14:52 ET,QS,,None,neutral,0.0
2026-06-20 14:52 ET,QS,what the agreement actually is it is explicitly described as a joint research agreement and a multiyear plan focused on solidstate battery development and associated manufacturing processes. honda entered this phase after completing a technical evaluation of qss t,None,neutral,0.8695
2026-06-20 14:52 ET,QS,this thing will dump out after it runs.,None,neutral,0.6759
2026-06-20 14:52 ET,QS,would honda enter this agreement if production was an issue?,Bullish,neutral,0.8017
2026-06-20 14:52 ET,QS,"honda not just evs. honda world39s 1 powersports maker 20.7m scootersmopedsmotorcyclesyr, 40 share lawn mowers jet skis. honda tech has potential across a range of applications",None,neutral,0.8485
2026-06-20 14:52 ET,QS,24h trending!!!,None,neutral,0.8686
2026-06-20 14:52 ET,QS,so honda validated their technology? thats a huge deal folks,None,neutral,0.6719
2026-06-20 14:52 ET,QS,,Bullish,neutral,0.0
